{"schema_version":2,"massif_id":"pyrenees","forecast_date":"2026-10-04","generated_at":"2026-10-04T18:56:24Z","timezone":"Europe/Paris","stations":{"font-romeu":{"id":"font-romeu","name":"Font-Romeu Pyrénées 2000","short_name":"Font-Romeu","lat":42.515,"lon":2.01,"elevation":{"base":1750,"mid":1980,"summit":2213},"aspects":["N","NE","E"],"website":null},"les-angles":{"id":"les-angles","name":"Les Angles","short_name":"Les Angles","lat":42.57,"lon":2.05,"elevation":{"base":1600,"mid":2000,"summit":2400},"aspects":["N","NE","E"],"website":null},"formigueres":{"id":"formigueres","name":"Formiguères","short_name":"Formiguères","lat":42.62,"lon":2.055,"elevation":{"base":1700,"mid":2020,"summit":2350},"aspects":["NE","E"],"website":null},"porte-puymorens":{"id":"porte-puymorens","name":"Porté-Puymorens","short_name":"Porté","lat":42.553,"lon":1.815,"elevation":{"base":1600,"mid":2050,"summit":2500},"aspects":["N","NW","W"],"website":null},"ax-3-domaines":{"id":"ax-3-domaines","name":"Ax 3 Domaines","short_name":"Ax 3 Domaines","lat":42.685,"lon":1.795,"elevation":{"base":1400,"mid":1900,"summit":2400},"aspects":["N","NE"],"website":null},"ascou-pailheres":{"id":"ascou-pailheres","name":"Ascou-Pailhères","short_name":"Ascou","lat":42.74,"lon":1.9,"elevation":{"base":1500,"mid":1760,"summit":2030},"aspects":["N"],"website":null},"guzet":{"id":"guzet","name":"Guzet","short_name":"Guzet","lat":42.788,"lon":1.3,"elevation":{"base":1100,"mid":1600,"summit":2100},"aspects":["N","NW"],"website":null},"le-mourtis":{"id":"le-mourtis","name":"Le Mourtis","short_name":"Le Mourtis","lat":42.877,"lon":0.77,"elevation":{"base":1380,"mid":1620,"summit":1860},"aspects":["N","NE"],"website":null},"peyragudes":{"id":"peyragudes","name":"Peyragudes","short_name":"Peyragudes","lat":42.795,"lon":0.455,"elevation":{"base":1600,"mid":2000,"summit":2400},"aspects":["N","E","W"],"website":null},"saint-lary":{"id":"saint-lary","name":"Saint-Lary","short_name":"Saint-Lary","lat":42.8,"lon":0.322,"elevation":{"base":1700,"mid":2110,"summit":2515},"aspects":["N","NE","E"],"website":null},"piau-engaly":{"id":"piau-engaly","name":"Piau-Engaly","short_name":"Piau","lat":42.788,"lon":0.158,"elevation":{"base":1420,"mid":2010,"summit":2600},"aspects":["N","NE"],"website":null},"val-louron":{"id":"val-louron","name":"Val Louron","short_name":"Val Louron","lat":42.807,"lon":0.413,"elevation":{"base":1450,"mid":1800,"summit":2150},"aspects":["N","E"],"website":null},"grand-tourmalet":{"id":"grand-tourmalet","name":"Grand Tourmalet","short_name":"Tourmalet","lat":42.91,"lon":0.18,"elevation":{"base":1400,"mid":1950,"summit":2500},"aspects":["N","E","S"],"website":null},"luz-ardiden":{"id":"luz-ardiden","name":"Luz Ardiden","short_name":"Luz Ardiden","lat":42.876,"lon":-0.07,"elevation":{"base":1680,"mid":2090,"summit":2500},"aspects":["N","E"],"website":null},"cauterets":{"id":"cauterets","name":"Cauterets – Cirque du Lys","short_name":"Cauterets","lat":42.866,"lon":-0.145,"elevation":{"base":1850,"mid":2130,"summit":2415},"aspects":["N","NE"],"website":null},"gourette":{"id":"gourette","name":"Gourette","short_name":"Gourette","lat":42.957,"lon":-0.333,"elevation":{"base":1400,"mid":1900,"summit":2400},"aspects":["N","E","W"],"website":null},"la-pierre-saint-martin":{"id":"la-pierre-saint-martin","name":"La Pierre Saint-Martin","short_name":"La Pierre St-Martin","lat":42.978,"lon":-0.757,"elevation":{"base":1450,"mid":1820,"summit":2200},"aspects":["N","NE"],"website":null},"superbagneres":{"id":"superbagneres","name":"Luchon-Superbagnères","short_name":"Superbagnères","lat":42.757,"lon":0.58,"elevation":{"base":1440,"mid":1850,"summit":2260},"aspects":["N","E","W"],"website":null}},"kpis":{"snowfall_chance":{"kpi_id":"snowfall_chance","aggregator_version":"2","periods":[{"key":"evening@2026-10-04","period_id":"evening","ski_day":"2026-10-04","start":"2026-10-04T18:00:00+02:00","end":"2026-10-05T00:00:00+02:00","generated_at":"2026-10-04T18:56:24Z","ranking":[{"station_id":"ascou-pailheres","probability":0.0,"confidence":"high","window_start":"2026-10-04T18:00:00+02:00","window_end":"2026-10-05T00:00:00+02:00","members":91,"drivers":{"deterministic_snow_cm":0.0,"members":91,"snow_cm_p50":0.0,"snow_cm_p90":0.0}},{"station_id":"ax-3-domaines","probability":0.0,"confidence":"high","window_start":"2026-10-04T18:00:00+02:00","window_end":"2026-10-05T00:00:00+02:00","members":91,"drivers":{"deterministic_snow_cm":0.0,"members":91,"snow_cm_p50":0.0,"snow_cm_p90":0.0}},{"station_id":"cauterets","probability":0.0,"confidence":"high","window_start":"2026-10-04T18:00:00+02:00","window_end":"2026-10-05T00:00:00+02:00","members":91,"drivers":{"deterministic_snow_cm":0.0,"members":91,"snow_cm_p50":0.0,"snow_cm_p90":0.0}},{"station_id":"font-romeu","probability":0.0,"confidence":"high","window_start":"2026-10-04T18:00:00+02:00","window_end":"2026-10-05T00:00:00+02:00","members":91,"drivers":{"deterministic_snow_cm":0.0,"members":91,"snow_cm_p50":0.0,"snow_cm_p90":0.0}},{"station_id":"formigueres","probability":0.0,"confidence":"high","window_start":"2026-10-04T18:00:00+02:00","window_end":"2026-10-05T00:00:00+02:00","members":91,"drivers":{"deterministic_snow_cm":0.0,"members":91,"snow_cm_p50":0.0,"snow_cm_p90":0.0}},{"station_id":"gourette","probability":0.0,"confidence":"high","window_start":"2026-10-04T18:00:00+02:00","window_end":"2026-10-05T00:00:00+02:00","members":91,"drivers":{"deterministic_snow_cm":0.0,"members":91,"snow_cm_p50":0.0,"snow_cm_p90":0.0}},{"station_id":"grand-tourmalet","probability":0.0,"confidence":"high","window_start":"2026-10-04T18:00:00+02:00","window_end":"2026-10-05T00:00:00+02:00","members":91,"drivers":{"deterministic_snow_cm":0.0,"members":91,"snow_cm_p50":0.0,"snow_cm_p90":0.0}},{"station_id":"guzet","probability":0.0,"confidence":"high","window_start":"2026-10-04T18:00:00+02:00","window_end":"2026-10-05T00:00:00+02:00","members":91,"drivers":{"deterministic_snow_cm":0.0,"members":91,"snow_cm_p50":0.0,"snow_cm_p90":0.0}},{"station_id":"la-pierre-saint-martin","probability":0.0,"confidence":"high","window_start":"2026-10-04T18:00:00+02:00","window_end":"2026-10-05T00:00:00+02:00","members":91,"drivers":{"deterministic_snow_cm":0.0,"members":91,"snow_cm_p50":0.0,"snow_cm_p90":0.0}},{"station_id":"le-mourtis","probability":0.0,"confidence":"high","window_start":"2026-10-04T18:00:00+02:00","window_end":"2026-10-05T00:00:00+02:00","members":91,"drivers":{"deterministic_snow_cm":0.0,"members":91,"snow_cm_p50":0.0,"snow_cm_p90":0.0}},{"station_id":"les-angles","probability":0.0,"confidence":"high","window_start":"2026-10-04T18:00:00+02:00","window_end":"2026-10-05T00:00:00+02:00","members":91,"drivers":{"deterministic_snow_cm":0.0,"members":91,"snow_cm_p50":0.0,"snow_cm_p90":0.0}},{"station_id":"luz-ardiden","probability":0.0,"confidence":"high","window_start":"2026-10-04T18:00:00+02:00","window_end":"2026-10-05T00:00:00+02:00","members":91,"drivers":{"deterministic_snow_cm":0.0,"members":91,"snow_cm_p50":0.0,"snow_cm_p90":0.0}},{"station_id":"peyragudes","probability":0.0,"confidence":"high","window_start":"2026-10-04T18:00:00+02:00","window_end":"2026-10-05T00:00:00+02:00","members":91,"drivers":{"deterministic_snow_cm":0.0,"members":91,"snow_cm_p50":0.0,"snow_cm_p90":0.0}},{"station_id":"piau-engaly","probability":0.0,"confidence":"high","window_start":"2026-10-04T18:00:00+02:00","window_end":"2026-10-05T00:00:00+02:00","members":91,"drivers":{"deterministic_snow_cm":0.0,"members":91,"snow_cm_p50":0.0,"snow_cm_p90":0.0}},{"station_id":"porte-puymorens","probability":0.0,"confidence":"high","window_start":"2026-10-04T18:00:00+02:00","window_end":"2026-10-05T00:00:00+02:00","members":91,"drivers":{"deterministic_snow_cm":0.0,"members":91,"snow_cm_p50":0.0,"snow_cm_p90":0.0}},{"station_id":"saint-lary","probability":0.0,"confidence":"high","window_start":"2026-10-04T18:00:00+02:00","window_end":"2026-10-05T00:00:00+02:00","members":91,"drivers":{"deterministic_snow_cm":0.0,"members":91,"snow_cm_p50":0.0,"snow_cm_p90":0.0}},{"station_id":"superbagneres","probability":0.0,"confidence":"high","window_start":"2026-10-04T18:00:00+02:00","window_end":"2026-10-05T00:00:00+02:00","members":91,"drivers":{"deterministic_snow_cm":0.0,"members":91,"snow_cm_p50":0.0,"snow_cm_p90":0.0}},{"station_id":"val-louron","probability":0.0,"confidence":"high","window_start":"2026-10-04T18:00:00+02:00","window_end":"2026-10-05T00:00:00+02:00","members":91,"drivers":{"deterministic_snow_cm":0.0,"members":91,"snow_cm_p50":0.0,"snow_cm_p90":0.0}}]},{"key":"night@2026-10-04","period_id":"night","ski_day":"2026-10-04","start":"2026-10-05T00:00:00+02:00","end":"2026-10-05T06:00:00+02:00","generated_at":"2026-10-04T18:56:24Z","ranking":[{"station_id":"ascou-pailheres","probability":0.0,"confidence":"high","window_start":"2026-10-05T00:00:00+02:00","window_end":"2026-10-05T06:00:00+02:00","members":91,"drivers":{"deterministic_snow_cm":0.0,"members":91,"snow_cm_p50":0.0,"snow_cm_p90":0.0}},{"station_id":"ax-3-domaines","probability":0.0,"confidence":"high","window_start":"2026-10-05T00:00:00+02:00","window_end":"2026-10-05T06:00:00+02:00","members":91,"drivers":{"deterministic_snow_cm":0.0,"members":91,"snow_cm_p50":0.0,"snow_cm_p90":0.0}},{"station_id":"cauterets","probability":0.0,"confidence":"high","window_start":"2026-10-05T00:00:00+02:00","window_end":"2026-10-05T06:00:00+02:00","members":91,"drivers":{"deterministic_snow_cm":0.0,"members":91,"snow_cm_p50":0.0,"snow_cm_p90":0.0}},{"station_id":"font-romeu","probability":0.0,"confidence":"high","window_start":"2026-10-05T00:00:00+02:00","window_end":"2026-10-05T06:00:00+02:00","members":91,"drivers":{"deterministic_snow_cm":0.0,"members":91,"snow_cm_p50":0.0,"snow_cm_p90":0.0}},{"station_id":"formigueres","probability":0.0,"confidence":"high","window_start":"2026-10-05T00:00:00+02:00","window_end":"2026-10-05T06:00:00+02:00","members":91,"drivers":{"deterministic_snow_cm":0.0,"members":91,"snow_cm_p50":0.0,"snow_c